<?xml version="1.0" encoding="UTF-8"?>
<registration xmlns:xsi="http://www.w3.org/2001/XMLSchema-instance"
    xsi:schemaLocation="gme://c3pr.cabig/2.0/edu.duke.cabig.c3pr.domain ../../../../core/resources/xsd/c3pr-domain.xsd"
    xmlns="gme://c3pr.cabig/2.0/edu.duke.cabig.c3pr.domain">
    <studySite>
        <healthcareSite gridId="siteGridId"/>
        <irbApprovalDate>2007-09-25</irbApprovalDate>
        <startDate>2007-09-25</startDate>
    </studySite>
    <studyRef gridId="testStudyGridId"> </studyRef>
    <participant xmlns:ns1="gme://c3pr.cabig/2.0/edu.duke.cabig.c3pr.domain">
        <ns1:firstName>tempStr</ns1:firstName>
        <ns1:lastName>tempStr</ns1:lastName>
        <ns1:address>
            <ns1:streetAddress>12359 Sunrise Valley Dr</ns1:streetAddress>
            <ns1:city>Reston</ns1:city>
            <ns1:stateCode>VA</ns1:stateCode>
            <ns1:postalCode>20191</ns1:postalCode>
            <ns1:countryCode>USA</ns1:countryCode>
        </ns1:address>
        <ns1:administrativeGenderCode>tempStr</ns1:administrativeGenderCode>
        <ns1:birthDate>2009-01-20</ns1:birthDate>
        <ns1:ethnicGroupCode>tempStr</ns1:ethnicGroupCode>
        <ns1:maritalStatusCode>tempStr</ns1:maritalStatusCode>
        <ns1:raceCode>tempStr</ns1:raceCode>    
        <ns1:identifier xsi:type="SystemAssignedIdentifierType">
            <ns1:source>asd</ns1:source>
            </ns1:identifier>
    </participant>
   
    <startDate>2009-01-20</startDate>
    <informedConsentFormSignedDate>2009-01-20</informedConsentFormSignedDate>

    <regDataEntryStatus>INCOMPLETE</regDataEntryStatus>
    <regWorkflowStatus>UNREGISTERED</regWorkflowStatus>
</registration>
